Lattice-Based Model of Ductal Carcinoma In Situ Suggests Rules for Breast Cancer Progression to an Invasive State,"Ductal carcinoma in situ (DCIS) is a heterogeneous group of non-invasive lesions of the breast that result from abnormal proliferation of mammary epithelial cells. Pathologists characterize DCIS by four tissue morphologies (micropapillary, cribriform, solid, and comedo), but the underlying mechanisms that distinguish the development and progression of these morphologies are not well understood. Here we explored the conditions leading to the emergence of the different morphologies of DCIS using a two-dimensional multi-cell lattice-based model that incorporates cell proliferation, apoptosis, necrosis, adhesion, and contractility. We found that the relative rates of cell proliferation and apoptosis governed which of the four morphologies emerged. High proliferation and low apoptosis favored the emergence of solid and comedo morphologies. In contrast, low proliferation and high apoptosis led to the micropapillary morphology, whereas high proliferation and high apoptosis led to the cribriform morphology. The natural progression between morphologies cannot be investigated in vivo since lesions are usually surgically removed upon detection; however, our model suggests probable transitions between these morphologies during breast cancer progression. Importantly, cribriform and comedo appear to be the ultimate morphologies of DCIS. Motivated by previous experimental studies demonstrating that tumor cells behave differently depending on where they are located within the mammary duct in vivo or in engineered tissues, we examined the effects of tissue geometry on the progression of DCIS. In agreement with our previous experimental work, we found that cells are more likely to invade from the end of ducts and that this preferential invasion is regulated by cell adhesion and contractility. This model provides additional insight into tumor cell behavior and allows the exploration of phenotypic transitions not easily monitored in vivo."
Using Mathematical Modelling as a Virtual Microscope to Support Biomedical Research,"This chapter will explain what kind of support mathematics can give to biology and medicine. In order to explain the concepts in practice cell migration is used as a specific example. This phenomenon is of great biomedical interest because it is a fundamental phenomenon both in physiological (e.g. wound healing, immune response) and pathological processes (e.g. chronic inflammation, detachment of metastasis and related tissue invasion). Also a key feature of any artificial system aimed atmimicking biological structures is to allow and enhance cellmigration on or inside it. At the same time anti-cancer treatment can become more efficient blocking cell’s capability to migrate towards distant sites and invade different organs."
Integrating multi-scale knowledge on cardiac development into a computational model of ventricular trabeculation,"Insights into the mechanisms of development of the mammalian four-chamberedheart are based on biological observations at organ, tissue, cell, and molecularlevels, but the full integration of these experimental data awaits a systems biologyapproach. Such an approach can be employed to formulate and test conceptualmodels in a computational simulation. To illustrate how this can be applied toheart development, we used the process of trabeculation, which is the formationof muscular strands during chamber development. We selected this processbecause it is localized, involves a restricted number of cell types, and a rangeof experimental data is available. Trabeculation of the ventricles is based onthe interplay between endocardial and myocardial cells and involves molecularpathways underlying cell–cell interactions and tissue-speciﬁc cell behavior. Acellular Potts model was used for the simulation of these multi-scale processes.With fairly simple inputs, of which the relative contributions are unknown, aniterative exploration achieved an outcome that resembles the trabeculation processand allows further investigation of contributing factors. The systems biologypipeline from biological observations and conceptual modeling to a mathematicalmodel and computational algorithms is described and discussed. The multi-levelbiological observations provide the components and their connections of theconceptual model. However, the true strength of systems biology must be foundin the biological test of the predictions that result from an experimental change inthe computational model. These validated predictions will ultimately elucidate thefunctional role of a component or interaction in the process of heart development"
Multiscale modeling of the early CD8 T cell immune response in lymph nodes: an integrative study,"CD8 T-cells are critical in controlling infection by intracellular pathogens. Upon encountering antigen presenting cells, T-cell receptor activation promotes the differentiation of naïve CD8 T-cells into strongly proliferating activated and effector stages. We propose a 2D-multiscale computational model to study the maturation of CD8 T-cells in a lymph node controlled by their molecular profile. A novel molecular pathway is presented and converted into an ordinary differential equation model, coupled with a cellular Potts model to describe cell-cell interactions. Key molecular players such as activated IL2 receptor and Tbet levels control the differentiation from naïve into activated and effector stages, respectively, while caspases and Fas-Fas ligand interactions control cell apoptosis. Coupling this molecular model to the cellular scale successfully reproduces qualitatively the evolution of total CD8 T-cell counts observed in mice lymph node, between Day 3 and 5.5 post-infection. Furthermore, this model allows us to make testable predictions of the evolution of the different CD8 T-cell stages."
Somites Without a Clock,"The formation of body segments (somites) in vertebrate embryos is accompanied by molecular oscillations (segmentation clock). Interaction of this oscillator with a wave traveling along the body axis (the clock-and-wavefront model) is generally believed to control somite number, size, and axial identity. Here we show that a clock-and-wavefront mechanism is unnecessary for somite formation. Non-somite mesoderm treated with Noggin generates many somites that form simultaneously, without cyclic expression of Notch-pathway genes, yet have normal size, shape, and fate. These somites have axial identity: The Hox code is fixed independently of somite fate. However, these somites are not subdivided into rostral and caudal halves, which is necessary for neural segmentation. We propose that somites are self-organizing structures whose size and shape is controlled by local cell-cell interactions."
Dynamics of cell aggregates fusion: Experiments and simulations,"Fusion of cell tissues is an ubiquitous phenomenon and has important technological applications including tissue biofabrication. In this work we present experimental results of aggregates fusion using adipose derived stem cells (ADSC) and a three dimensional computer simulation of the process using the cellular Potts model with aggregates reaching 10,000 cells. We consider fusion of round aggregates and monitor the dimensionless neck area of contact between the two aggregates to characterize the process, as done for the coalescence of liquid droplets and polymers. Both experiments and simulations show that the evolution of this quantity obeys a power law in time. We also study quantitatively individual cell motion with the simulation and it corresponds to an anomalous diffusion."
Synergy of cell–cell repulsion and vacuolation in a computational model of lumen formation,"A key step in blood vessel development (angiogenesis) is lumen formation: the hollowing of vessels for blood perfusion. Two alternative lumen formation mechanisms are suggested to function in different types of blood vessels. The vacuolation mechanism is suggested for lumen formation in small vessels by coalescence of intracellular vacuoles, a view that was extended to extracellular lumen formation by exocytosis of vacuoles. The cell–cell repulsion mechanism is suggested to initiate extracellular lumen formation in large vessels by active repulsion of adjacent cells, and active cell shape changes extend the lumen. We used an agent-based computer model, based on the cellular Potts model, to compare and study both mechanisms separately and combined. An extensive sensitivity analysis shows that each of the mechanisms on its own can produce lumens in a narrow region of parameter space. However, combining both mechanisms makes lumen formation much more robust to the values of the parameters, suggesting that the mechanisms may work synergistically and operate in parallel, rather than in different vessel types."
"The effects of cell compressibility, motility and contact inhibition on the growth of tumor cell clusters using the Cellular Potts Model","There are numerous biological examples where genes associated with migratory ability of cells also confer the cells with an increased fitness even though these genes may not have any known effect on the cell mitosis rates. Here, we provide insight into these observations by analyzing the effects of cell migration, compression, and contact inhibition on the growth of tumor cell clusters using the Cellular Potts Model (CPM) in a monolayer geometry. This is a follow-up of a previous study (Thalhauser et al. 2010) in which a Moran-type model was used to study the interaction of cell proliferation, migratory potential and death on the emergence of invasive phenotypes. Here, we extend the study to include the effects of cell size and shape. In particular, we investigate the interplay between cell motility and compressibility within the CPM and find that the CPM predicts that increased cell motility leads to smaller cells. This is an artifact in the CPM. An analysis of the CPM reveals an explicit inverse-relationship between the cell stiffness and motility parameters. We use this relationship to compensate for motility-induced changes in cell size in the CPM so that in the corrected CPM, cell size is independent of the cell motility. We find that subject to comparable levels of compression, clusters of motile cells grow faster than clusters of less motile cells, in qualitative agreement with biological observations and our previous study. Increasing compression tends to reduce growth rates. Contact inhibition penalizes clumped cells by halting their growth and gives motile cells an even greater advantage. Finally, our model predicts cell size distributions that are consistent with those observed in clusters of neuroblastoma cells cultured in low and high density conditions."
Advances in Modelling of Epithelial to Mesenchymal Transition,"This paper presents simulations of in vitro Epithelial to Mesenchymal Transition (EMT). The conditions of 2D migration on the surface, and 3D invasion into a collagen gel are represented as a cellular Potts model. The model demonstrates that a loss of endocardial adhesion is a sufficient condition for 2D migration behaviour, while a simultaneous loss of endocardial cohesion and gain in endocardial to collagen gel adhesion is a sufficient condition for 3D invasion. The 3D model captures the hierarchy effective surface tensions that correspond to the three experimental conditions of stable monolayer, 2D migration, and 3D invasion. A 2D cellular Potts model is used to investigate the relationship between cell shape changes, motility and adhesion during the condition of 2D migration."
A design principle underlying the paradoxical roles of E3 ubiquitin ligases,"E3 ubiquitin ligases are important cellular components that determine the specificity of proteolysis in the ubiquitin-proteasome system. However, an increasing number of studies have indicated that E3 ubiquitin ligases also participate in transcription. Intrigued by the apparently paradoxical functions of E3 ubiquitin ligases in both proteolysis and transcriptional activation, we investigated the underlying design principles using mathematical modeling. We found that the antagonistic functions integrated in E3 ubiquitin ligases can prevent any undesirable sustained activation of downstream genes when E3 ubiquitin ligases are destabilized by unexpected perturbations. Interestingly, this design principle of the system is similar to the operational principle of a safety interlock device in engineering systems, which prevents a system from abnormal operation unless stability is guaranteed."
Advances in Modelling of Epithelial to Mesenchymal Transition,"This paper presents simulations of in vitro Epithelial to Mesenchymal Transition (EMT). The conditions of 2D migration on the surface, and 3D invasion into a collagen gel are represented as a cellular Potts model. The model demonstrates that a loss of endocardial adhesion is a sufficient condition for 2D migration behaviour, while a simultaneous loss of endocardial cohesion and gain in endocardial to collagen gel adhesion is a sufficient condition for 3D invasion. The 3D model captures the hierarchy effective surface tensions that correspond to the three experimental conditions of stable monolayer, 2D migration, and 3D invasion. A 2D cellular Potts model is used to investigate the relationship between cell shape changes, motility and adhesion during the condition of 2D migration."
Hyaluronan: A critical regulator of endothelial-to-mesenchymal transition during cardiac valve formation,"During embryonic development, cardiac valves arise at specific regions in the cardiac endothelium that swell up due to enhanced extracellular matrix production (so-called endocardial cushions). An important extracellular matrix component that is produced by the endocardial cells is the glycosaminoglycan hyaluronan. A deficiency in hyaluronan synthesis results in a failure to form endocardial cushions and a loss of their cellularization by a process called endothelial-to-mesenchymal transformation. Expression of the major hyaluronan synthase Has2 is under the influence of both positive and negative regulators. MicroRNA-dependent degradation of Has2 is required to control extracellular hyaluronan levels and thereby the size of the endocardial cushions. In this article, we review the current literature on hyaluronan synthesis during cardiac valve formation and propose that a balanced activity of both positive and negative regulators is required to maintain the critical homeostasis of hyaluronan levels in the extracellular matrix and thereby the size of the endocardial cushions. The activating and inhibitory interactions between microRNA-23, Has2, and hyaluronan are reminiscent of a reaction–diffusion system. Using a mathematical modeling approach we show that the system can produce a confined expression of hyaluronan, but only if the inhibitory signal is transferred to adjacent cells in exosomes."
"Ovarian Tumor Attachment, Invasion, and Vascularization Reflect Unique Microenvironments in the Peritoneum: Insights from Xenograft and Mathematical Models","Ovarian cancer relapse is often characterized by metastatic spread throughout the peritoneal cavity with tumors attached to multiple organs. In this study, interaction of ovarian cancer cells with the peritoneal tumor microenvironment was evaluated in a xenograft model based on intraperitoneal injection of fluorescent SKOV3.ip1 ovarian cancer cells. Intra-vital microscopy of mixed GFP-red fluorescent protein (RFP) cell populations injected into the peritoneum demonstrated that cancer cells aggregate and attach as mixed spheroids, emphasizing the importance of homotypic adhesion in tumor formation. Electron microscopy provided high resolution structural information about local attachment sites. Experimental measurements from the mouse model were used to build a three-dimensional cellular Potts ovarian tumor model (OvTM) that examines ovarian cancer cell attachment, chemotaxis, growth, and vascularization. OvTM simulations provide insight into the relative influence of cancer cell–cell adhesion, oxygen availability, and local architecture on tumor growth and morphology. Notably, tumors on the mesentery, omentum, or spleen readily invade the “open” architecture, while tumors attached to the gut encounter barriers that restrict invasion and instead rapidly expand into the peritoneal space. Simulations suggest that rapid neovascularization of SKOV3.ip1 tumors is triggered by constitutive release of angiogenic factors in the absence of hypoxia. This research highlights the importance of cellular adhesion and tumor microenvironment in the seeding of secondary ovarian tumors on diverse organs within the peritoneal cavity. Results of the OvTM simulations indicate that invasion is strongly influenced by features underlying the mesothelial lining at different sites, but is also affected by local production of chemotactic factors. The integrated in vivo mouse model and computer simulations provide a unique platform for evaluating targeted therapies for ovarian cancer relapse."
A Computational Model Predicting Disruption of Blood Vessel Development,"Vascular development is a complex process regulated by dynamic biological networks that vary in topology and state across different tissues and developmental stages. Signals regulating de novo blood vessel formation (vasculogenesis) and remodeling (angiogenesis) come from a variety of biological pathways linked to endothelial cell (EC) behavior, extracellular matrix (ECM) remodeling and the local generation of chemokines and growth factors. Simulating these interactions at a systems level requires sufficient biological detail about the relevant molecular pathways and associated cellular behaviors, and tractable computational models that offset mathematical and biological complexity. Here, we describe a novel multicellular agent-based model of vasculogenesis using the CompuCell3D (http://www.compucell3d.org/) modeling environment supplemented with semi-automatic knowledgebase creation. The model incorporates vascular endothelial growth factor signals, pro- and anti-angiogenic inflammatory chemokine signals, and the plasminogen activating system of enzymes and proteases linked to ECM interactions, to simulate nascent EC organization, growth and remodeling. The model was shown to recapitulate stereotypical capillary plexus formation and structural emergence of non-coded cellular behaviors, such as a heterologous bridging phenomenon linking endothelial tip cells together during formation of polygonal endothelial cords. Molecular targets in the computational model were mapped to signatures of vascular disruption derived from in vitro chemical profiling using the EPA's ToxCast high-throughput screening (HTS) dataset. Simulating the HTS data with the cell-agent based model of vascular development predicted adverse effects of a reference anti-angiogenic thalidomide analog, 5HPP-33, on in vitro angiogenesis with respect to both concentration-response and morphological consequences. These findings support the utility of cell agent-based models for simulating a morphogenetic series of events and for the first time demonstrate the applicability of these models for predictive toxicology."
Vascular Networks Due to Dynamically Arrested Crystalline Ordering of Elongated Cells,"Recent experimental and theoretical studies suggest that crystallization and glass-like solidification are useful analogies for understanding cell ordering in confluent biological tissues. It remains unexplored how cellular ordering contributes to pattern formation during morphogenesis. With a computational model we show that a system of elongated, cohering biological cells can get dynamically arrested in a network pattern. Our model provides an explanation for the formation of cellular networks in culture systems that exclude intercellular interaction via chemotaxis or mechanical traction."
Front Instabilities and Invasiveness of Simulated 3D Avascular Tumors,"We use the Glazier-Graner-Hogeweg model to simulate three-dimensional (3D), single-phenotype, avascular tumors growing in an homogeneous tissue matrix (TM) supplying a single limiting nutrient. We study the effects of two parameters on tumor morphology: a diffusion-limitation parameter defined as the ratio of the tumor-substrate consumption rate to the substrate-transport rate, and the tumor-TM surface tension. This initial model omits necrosis and oxidative/hypoxic metabolism effects, which can further influence tumor morphology, but our simplified model still shows significant parameter dependencies. The diffusion-limitation parameter determines whether the growing solid tumor develops a smooth (noninvasive) or fingered (invasive) interface, as in our earlier two-dimensional (2D) simulations. The sensitivity of 3D tumor morphology to tumor-TM surface tension increases with the size of the diffusion-limitation parameter, as in 2D. The 3D results are unexpectedly close to those in 2D. Our results therefore may justify using simpler 2D simulations of tumor growth, instead of more realistic but more computationally expensive 3D simulations. While geometrical artifacts mean that 2D sections of connected 3D tumors may be disconnected, the morphologies of 3D simulated tumors nevertheless correlate with the morphologies of their 2D sections, especially for low-surface-tension tumors, allowing the use of 2D sections to partially reconstruct medically-important 3D-tumor structures."
Computer Simulation of Cellular Patterning Within the Drosophila Pupal Eye,"We present a computer simulation and associated experimental validation of assembly of glial-like support cells into the interweaving hexagonal lattice that spans the Drosophila pupal eye. This process of cell movements organizes the ommatidial array into a functional pattern. Unlike earlier simulations that focused on the arrangements of cells within individual ommatidia, here we examine the local movements that lead to large-scale organization of the emerging eye field. Simulations based on our experimental observations of cell adhesion, cell death, and cell movement successfully patterned a tracing of an emerging wild-type pupal eye. Surprisingly, altering cell adhesion had only a mild effect on patterning, contradicting our previous hypothesis that the patterning was primarily the result of referential adhesion between IRMclass surface proteins. Instead, our simulations highlighted the importance of programmed cell death (PCD) as well as a previously unappreciated variable: the expansion of cells’ apical surface areas, which promoted rearrangement of neighboring cells. We tested this prediction experimentally by preventing expansion in the apical area of individual cells: patterning was disrupted in a manner predicted by our simulations. Our work demonstrates the value of combining computer simulation with in vivo experiments to uncover novel mechanisms that are perpetuated throughout the eye field. It also demonstrates the utility of the Glazier–Graner–Hogeweg model (GGH) for modeling the links between local cellular interactions and emergent properties of developing epithelia as well as predicting unanticipated results in vivo."
3D Multi-Cell Simulation of Tumor Growth and Angiogenesis,"We present a 3D multi-cell simulation of a generic simplification of vascular tumor growth which can be easily extended and adapted to describe more specific vascular tumor types and host tissues. Initially, tumor cells proliferate as they take up the oxygen which the pre-existing vasculature supplies. The tumor grows exponentially. When the oxygen level drops below a threshold, the tumor cells become hypoxic and start secreting pro-angiogenic factors. At this stage, the tumor reaches a maximum diameter characteristic of an avascular tumor spheroid. The endothelial cells in the pre-existing vasculature respond to the pro-angiogenic factors both by chemotaxing towards higher concentrations of pro-angiogenic factors and by forming new blood vessels via angiogenesis. The tumor-induced vasculature increases the growth rate of the resulting vascularized solid tumor compared to an avascular tumor, allowing the tumor to grow beyond the spheroid in these lineargrowth phases. First, in the linear-spherical phase of growth, the tumor remains spherical while its volume increases. Second, in the linear-cylindrical phase of growth the tumor elongates into a cylinder. Finally, in the linear-sheet phase of growth, tumor growth accelerates as the tumor changes from cylindrical to paddle-shaped. Substantial periods during which the tumor grows slowly or not at all separate the exponential from the linear-spherical and the linear-spherical from the linear-cylindrical growth phases. In contrast to other simulations in which avascular tumors remain spherical, our simulated avascular tumors form cylinders following the blood vessels, leading to a different distribution of hypoxic cells within the tumor. Our simulations cover time periods which are long enough to produce a range of biologically reasonable complex morphologies, allowing us to study how tumor-induced angiogenesis affects the growth rate, size and morphology of simulated tumors."
