Mathematical Modeling of the Capillary-Like Pattern Generated by Adrenomedullin-Treated Human Vascular Endothelial Cells In Vitro,"A recently proposed approach was used to model the self-organization into capillary-like structures of human vascular endothelial cells cultured on Matrigel. The model combines a Cellular Potts Model, considering cell adhesion, cytoskeletal rearrangement and chemotaxis, and a Partial Differential Equation model describing the release and the diffusion of a chemoattractant. The results were compared with the data from real in vitro experiments to establish the capability of the model to accurately reproduce both the spontaneous self-assembly of unstimulated cells and their self-organization in the presence of the proangiogenic factor adrenomedullin. The results showed that the model can accurately reproduce the self-assembly of unstimulated cells, but it failed in reproducing the adrenomedullin-induced self-organization of the cells. The extension of the model to include cell proliferation led to a good match between simulated and experimental patterns in both cases with predicted proliferation rates in agreement with the data of cell proliferation experiments."
Evolution and Morphogenesis of Differentiated Multicellular Organisms:Autonomously Generated Diffusion Gradients for Positional Information,"Development is the powerful process involving a genome in the transformation from one egg cell to a multicellular organism with many cell types. The dividing cells manage to organize and assign themselves special, differentiated roles in a reliable manner, creating a spatio-temporal pattern and division of labor. This despite the fact that little positional information may be available to them initially to guide this patterning. Inspired by a model of developmental biologist L. Wolpert, we simulate this situation in an evolutionary setting where individuals have to grow into “French flag” patterns. The cells in our model exist in a 2-layer Potts model physical environment. Controlled by continuous genetic regulatory networks, identical for all cells of one individual, the cells can individually differ in parameters including target volume, shape, orientation, and diffusion. Intercellular communication is possible via secretion and sensing of diffusing morphogens. Evolved individuals growing from a single cell can develop the French flag pattern by setting up and maintaining asymmetric morphogen gradients – a behavior predicted by several theoretical models."
SIMULATION OF SINGLE-SPECIES BACTERIAL-BIOFILM GROWTH USING THE GLAZIER-GRANER-HOGEWEG MODEL AND THE COMPUCELL3D MODELING ENVIRONMENT,"The CompuCell3D modeling environment provides a convenient platform for biofilm simulations using the Glazier-Graner-Hogeweg (GGH) model, a cell-oriented framework designed to simulate growth and pattern formation due to biological cells’ behaviors. We show how to develop such a simulation, based on the hybrid (continuum-discrete) model of Picioreanu, van Loosdrecht, and Heijnen (PLH), simulate the growth of a single-species bacterial biofilm, and study the roles of cell-cell and cell-field interactions in determining biofilm morphology. In our simulations, which generalize the PLH model by treating cells as spatially extended, deformable bodies, differential adhesion between cells, and their competition for a substrate (nutrient), suffice to produce a fingering instability that generates the finger shapes of biofilms. Our results agree with most features of the PLH model, although our inclusion of cell adhesion, which is difficult to implement using other modeling approaches, results in slightly different patterns. Our simulations thus provide the groundwork for simulations of medically and industrially important multispecies biofilms."
Discovering Novel Cancer Therapies:A Computational Modeling and Search Approach,"Solid tumors must recruit new blood vessels for growth and maintenance. Discovering drugs that block this tumor-induced development of new blood vessels (angiogenesis) is an important approach in cancer treatment. However, the complexity of angiogenesis and the difficulty in implementing and evaluating rationally-designed treatments prevent the discovery of effective new therapies. This paper presents a massively parallel computational search-based approach for the discovery of novel potential cancer treatments using a high fidelity simulation of angiogenesis. Discovering new therapies is viewed as multi-objective combinatorial optimization over two competing objectives: minimizing the cost of developing the intervention while minimizing the oxygen provided to the cancer tumor by angiogenesis. Results show the effectiveness of the search process in finding interventions that are currently in use and more interestingly, discovering some new approaches that are counter intuitive yet effective."
"Coordinated Action of N-CAM, N-cadherin, EphA4, and ephrinB2 Translates Genetic Prepatterns into Structure during Somitogenesis in Chick","During gastrulation in vertebrates, mesenchymal cells at the anterior end of the presomitic mesoderm (PSM) periodically compact, transiently epithelialize and detach from the posterior PSM to form somites. In the prevailing clock-and-wavefront model of somitogenesis, periodic gene expression, particularly of Notch and Wnt, interacts with an FGF8-based thresholding mechanism to determine cell fates. However, this model does not explain how cell determination and subsequent differentiation translates into somite morphology. In this paper, we use computer simulations of chick somitogenesis to show that experimentally-observed temporal and spatial patterns of adhesive N-CAM and N-cadherin and repulsive EphA4–ephrinB2 pairs suffice to reproduce the complex dynamic morphological changes of somitogenesis in wild-type and N-cadherin (?/?) chick, including intersomitic separation, boundary-shape evolution and sorting of misdifferentiated cells across compartment boundaries. Since different models of determination yield the same, experimentally-observed, distribution of adhesion and repulsion molecules, the patterning is independent of the details of this mechanism."
From Genes to Organisms Via the Cell A Problem-Solving Environment for Multicellular Development,"To gain performance, developers often build scientific applications in procedural languages, such as C or Fortran, which unfortunately reduces flexibility. To address this imbalance, the authors present CompuCell3D, a multitiered, flexible, and scalable problem-solving environment for morphogenesis simulations that's written in C++ using object-oriented design patterns."
"Adhesion between cells, diffusion of growth factors, and elasticity of the AER produce the paddle shape of the chick limb","A central question in developmental biology is how cells interact to organize into tissues? In this paper, we study the role of mesenchyme-ectoderm interaction in the growing chick limb bud using Glazier and Graner's cellular Potts model, a grid-based stochastic framework designed to simulate cell interactions and movement. We simulate cellular mechanisms including cell adhesion, growth, and division and diffusion of morphogens, to show that differential adhesion between the cells, diffusion of growth factors through the extracellular matrix, and the elastic properties of the apical ectodermal ridge together can produce the proper shape of the limb bud."
A Framework for Three-Dimensional Simulation of Morphogenesis,"We present COMPUCELL3D, a software framework for three-dimensional simulation of morphogenesis in different organisms. COMPUCELL3D employs biologically relevant models for cell clustering, growth, and interaction with chemical fields. COMPUCELL3D uses design patterns for speed, efficient memory management, extensibility, and flexibility to allow an almost unlimited variety of simulations. We have verified COMPUCELL3D by building a model of growth and skeletal pattern formation in the avian (chicken) limb bud."
On multiscale approaches to three-dimensional modelling of morphogenesis,"In this paper we present the foundation of a unified, object-oriented, three-dimensional biomodelling environment, which allows us to integrate multiple submodels at scales from subcellular to those of tissues and organs. Our current implementation combines a modified discrete model from statistical mechanics, the Cellular Potts Model, with a continuum reaction–diffusion model and a state automaton with well-defined conditions for cell differentiation transitions to model genetic regulation. This environment allows us to rapidly and compactly create computational models of a class of complex-developmental phenomena. To illustrate model development, we simulate a simplified version of the formation of the skeletal pattern in a growing embryonic vertebrate limb."
A cell-centered approach to developmental biology,"Explaining embryonic development of multicellular organisms requires insight into complex interactions between genetic regulation and physical, generic mechanisms at multiple scales. As more physicists move into developmental biology, we need to be aware of the ‘‘cultural’’ differences between the two fields, whose concepts of ‘‘explanations’’ and ‘‘models’’ traditionally differ: biologists aiming to identify genetic pathways and expression patterns, physicists tending to look for generic underlying principles. Here we discuss how we can combine such biological and physical approaches into a cell-centered approach to developmental biology. Genetic information can only indirectly influence the morphology and physiology of multicellular organisms. DNA translates into proteins and regulatory RNA sequences, which steer the biophysical properties of cells, their response to signals from neighboring cells, and the production and properties of extracellular matrix (ECM).We argue that in many aspects of biological development, cells’ inner workings are irrelevant: what matter are the cell’s biophysical properties, the signals it emits and its responses to extracellular signals. Thus we can separate questions about genetic regulation from questions about development. First, we ask what effects a gene network has on cell phenomenology, and how it operates. We then ask through which mechanisms such single-cell phenomenology directs multicellular morphogenesis and physiology. This approach treats the cell as the fundamental module of development. We discuss how this cell-centered approach—which requires significant input from computational biophysics—can assist and supplement experimental research in developmental biology. We review cell-centered approaches, focusing in particular on the Cellular Potts Model (CPM), and present the Tissue Simulation Toolkit which implements the CPM."
Multiscale Models for Vertebrate Limb Development,"Dynamical systems in which geometrically extended model cells produce and interact with diffusible (morphogen) and non-diffusible (extracellular matrix) chemical fields have proved very useful as models for developmental processes. The embryonic vertebrate limb is an apt system for such mathematical and computational modeling since it has been the subject of hundreds of experimental studies, and its normal and variant morphologies and spatiotemporal organization of expressed genes are well known. Because of its stereotypical proximodistally generated increase in the number of parallel skeletal elements, the limb lends itself to being modeled by Turing-type systems which are capable of producing periodic, or quasiperiodic, arrangements of spot- and stripe-like elements. This chapter describes several such models, including, (i) a system of partial differential equations in which changing cell density enters into the dynamics explicitly, (ii) a model for morphogen dynamics alone, derived from the latter system in the “morphostatic limit” where cell movement relaxes on a much slower time-scale than cell differentiation, (iii) a discrete stochastic model for the simplified pattern formation that occurs when limb cells are placed in planar culture, and (iv) several hybrid models in which continuum morphogen systems interact with cells represented as energy-minimizing mesoscopic entities. Progress in devising computational methods for handling 3D, multiscale, multimodel simulations of organogenesis is discussed, as well as for simulating reaction–diffusion dynamics in domains of irregular shape."
Dynamical mechanisms for skeletal pattern formation in the vertebrate limb,"We describe a ‘reactor–diffusion’ mechanism for precartilage condensation based on recent experiments on chondrogenesis in the early vertebrate limb and additional hypotheses. Cellular differentiation of mesenchymal cells into subtypes with different fibroblast growth factor (FGF) receptors occurs in the presence of spatio-temporal variations of FGFs and transforming growth factor-betas (TGF-?s). One class of differentiated cells produces elevated quantities of the extracellular matrix protein fibronectin, which initiates adhesion-mediated preskeletal mesenchymal condensation. The same class of cells also produces an FGFdependent laterally acting inhibitor that keeps condensations from expanding beyond a critical size. We show that this ‘reactor–diffusion’ mechanism leads naturally to patterning consistent with skeletal form, and describe simulations of spatio-temporal distribution of these differentiated cell types and the TGF-? and inhibitor concentrations in the developing limb bud."
